<?xml version='1.0' encoding='windows-1252' ?>
<!DOCTYPE ViewObject SYSTEM "jbo_03_01.dtd">

<ViewObject
   Name="BatchRunNameListView"
   BindingStyle="JDBC"
   CustomQuery="true"
   RowClass="com.cylande.unitedretail.batch.business.query.BatchRunNameListViewRowImpl"
   ComponentClass="com.cylande.unitedretail.batch.business.query.BatchRunNameListViewImpl"
   DefClass="com.cylande.unitedretail.framework.business.jbo.server.ViewDefImpl"
   ComponentInterface="com.cylande.unitedretail.batch.business.query.common.BatchRunNameListView"
   ClientProxyName="com.cylande.unitedretail.batch.business.query.client.BatchRunNameListViewClient"
   RowInterface="com.cylande.unitedretail.batch.business.query.common.BatchRunNameListViewRow"
   ClientRowProxyName="com.cylande.unitedretail.batch.business.query.client.BatchRunNameListViewRowClient"
   FetchMode="FETCH_AS_NEEDED"
   UseGlueCode="false" >
   <SQLQuery><![CDATA[
SELECT DISTINCT BRUN.BATCH_CODE as BRUNPATH
FROM batch_run BRUN
WHERE BRUN.BATCH_CODE NOT LIKE '%.%'
   ]]></SQLQuery>
   <DesignTime>
      <Attr Name="_isCodegen" Value="true" />
      <Attr Name="_isExpertMode" Value="true" />
      <Attr Name="_version" Value="10.1.3.41.57" />
      <Attr Name="_codeGenFlag2" Value="Access|Coll|VarAccess" />
   </DesignTime>
   <ViewAttribute
      Name="Brunpath"
      IsUpdateable="false"
      IsPersistent="false"
      Precision="256"
      Type="java.lang.String"
      ColumnType="VARGRAPHIC"
      AliasName="BRUNPATH"
      Expression="BRUNPATH"
      SQLType="VARCHAR" >
      <DesignTime>
         <Attr Name="_DisplaySize" Value="256" />
      </DesignTime>
   </ViewAttribute>
</ViewObject>
