<?xml version='1.0' encoding='windows-1252' ?>
<!DOCTYPE ViewLink SYSTEM "jbo_03_01.dtd">

<ViewLink
   Name="TaskRunsOfBatchRunLink"
   EntityAssociation="com.cylande.unitedretail.batch.business.entity.association.TaskRunsOfBatchRun" >
   <DesignTime>
      <Attr Name="_isCodegen" Value="true" />
      <Attr Name="_version" Value="10.1.3.41.57" />
   </DesignTime>
   <ViewLinkDefEnd
      Name="BatchRunView"
      Cardinality="1"
      Owner="com.cylande.unitedretail.batch.business.query.BatchRunView"
      Source="true" >
      <AttrArray Name="Attributes">
         <Item Value="com.cylande.unitedretail.batch.business.query.BatchRunView.Id" />
      </AttrArray>
      <DesignTime>
         <Attr Name="_finderName" Value="BatchRunView" />
         <Attr Name="_isUpdateable" Value="true" />
      </DesignTime>
   </ViewLinkDefEnd>
   <ViewLinkDefEnd
      Name="TaskRunChildrenView"
      Cardinality="-1"
      Owner="com.cylande.unitedretail.batch.business.query.TaskRunView" >
      <AttrArray Name="Attributes">
         <Item Value="com.cylande.unitedretail.batch.business.query.TaskRunView.ParentId" />
      </AttrArray>
      <DesignTime>
         <Attr Name="_finderName" Value="TaskRunChildrenView" />
         <Attr Name="_isUpdateable" Value="true" />
      </DesignTime>
   </ViewLinkDefEnd>
</ViewLink>
