<?xml version='1.0' encoding='windows-1252' ?>
<!DOCTYPE ViewObject SYSTEM "jbo_03_01.dtd">

<ViewObject
   Name="TaskRunView"
   SelectList="TaskRun.CREATION_TIME, 
       TaskRun.CREATION_USER_CODE, 
       TaskRun.MODIFICATION_TIME, 
       TaskRun.MODIFICATION_USER_CODE, 
       TaskRun.TASK_CODE, 
       TaskRun.ID, 
       TaskRun.PARENT_ID, 
       TaskRun.START_TIME, 
       TaskRun.END_TIME, 
       TaskRun.STATE, 
       TaskRun.WORK_LOAD, 
       TaskRun.WORK_PROGRESS, 
       TaskRun.STEP, 
       TaskRun.DOMAIN, 
       TaskRun.SITE_CODE, 
       TaskRun.TASK_TYPE, 
       TaskRun.PROCESS_NAME, 
       TaskRun.PROCESS_DOMAIN, 
       TaskRun.INPUT_NAME, 
       TaskRun.INPUT_DOMAIN, 
       TaskRun.RESPONSE_NAME, 
       TaskRun.RESPONSE_DOMAIN, 
       TaskRun.REJECT_NAME, 
       TaskRun.REJECT_DOMAIN, 
       TaskRun.IN_ERROR"
   FromList="TASK_RUN TaskRun"
   BindingStyle="JDBC"
   CustomQuery="false"
   RowClass="com.cylande.unitedretail.batch.business.query.TaskRunViewRowImpl"
   ComponentClass="com.cylande.unitedretail.batch.business.query.TaskRunViewImpl"
   DefClass="com.cylande.unitedretail.framework.business.jbo.server.ViewDefImpl"
   ComponentInterface="com.cylande.unitedretail.batch.business.query.common.TaskRunView"
   ClientProxyName="com.cylande.unitedretail.batch.business.query.client.TaskRunViewClient"
   RowInterface="com.cylande.unitedretail.batch.business.query.common.TaskRunViewRow"
   ClientRowProxyName="com.cylande.unitedretail.batch.business.query.client.TaskRunViewRowClient"
   FetchMode="FETCH_AS_NEEDED"
   UseGlueCode="false" >
   <DesignTime>
      <Attr Name="_isCodegen" Value="true" />
      <Attr Name="_version" Value="10.1.3.41.57" />
      <Attr Name="_codeGenFlag2" Value="Access|Coll|VarAccess" />
   </DesignTime>
   <EntityUsage
      Name="TaskRun"
      Entity="com.cylande.unitedretail.batch.business.entity.TaskRun" >
      <DesignTime>
         <Attr Name="_queryClause" Value="false" />
      </DesignTime>
   </EntityUsage>
   <ViewAttribute
      Name="CreationTime"
      IsUpdateable="false"
      EntityAttrName="CreationTime"
      EntityUsage="TaskRun"
      AliasName="CREATION_TIME" >
   </ViewAttribute>
   <ViewAttribute
      Name="CreationUserCode"
      IsUpdateable="false"
      EntityAttrName="CreationUserCode"
      EntityUsage="TaskRun"
      AliasName="CREATION_USER_CODE" >
   </ViewAttribute>
   <ViewAttribute
      Name="ModificationTime"
      IsUpdateable="false"
      EntityAttrName="ModificationTime"
      EntityUsage="TaskRun"
      AliasName="MODIFICATION_TIME" >
   </ViewAttribute>
   <ViewAttribute
      Name="ModificationUserCode"
      IsUpdateable="false"
      EntityAttrName="ModificationUserCode"
      EntityUsage="TaskRun"
      AliasName="MODIFICATION_USER_CODE" >
   </ViewAttribute>
   <ViewAttribute
      Name="Path"
      IsUpdateable="while_insert"
      IsNotNull="true"
      EntityAttrName="Path"
      EntityUsage="TaskRun"
      AliasName="TASK_CODE" >
   </ViewAttribute>
   <ViewAttribute
      Name="Id"
      IsUpdateable="while_insert"
      IsNotNull="true"
      EntityAttrName="Id"
      EntityUsage="TaskRun"
      AliasName="ID" >
   </ViewAttribute>
   <ViewAttribute
      Name="ParentId"
      EntityAttrName="ParentId"
      EntityUsage="TaskRun"
      AliasName="PARENT_ID" >
   </ViewAttribute>
   <ViewAttribute
      Name="StartTime"
      EntityAttrName="StartTime"
      EntityUsage="TaskRun"
      AliasName="START_TIME" >
   </ViewAttribute>
   <ViewAttribute
      Name="EndTime"
      EntityAttrName="EndTime"
      EntityUsage="TaskRun"
      AliasName="END_TIME" >
   </ViewAttribute>
   <ViewAttribute
      Name="Status"
      EntityAttrName="Status"
      EntityUsage="TaskRun"
      AliasName="STATE" >
   </ViewAttribute>
   <ViewAttribute
      Name="WorkLoad"
      EntityAttrName="WorkLoad"
      EntityUsage="TaskRun"
      AliasName="WORK_LOAD" >
   </ViewAttribute>
   <ViewAttribute
      Name="WorkProgress"
      EntityAttrName="WorkProgress"
      EntityUsage="TaskRun"
      AliasName="WORK_PROGRESS" >
   </ViewAttribute>
   <ViewAttribute
      Name="Step"
      EntityAttrName="Step"
      EntityUsage="TaskRun"
      AliasName="STEP" >
   </ViewAttribute>
   <ViewAttribute
      Name="Domain"
      EntityAttrName="Domain"
      EntityUsage="TaskRun"
      AliasName="DOMAIN" >
   </ViewAttribute>
   <ViewAttribute
      Name="SiteCode"
      IsUpdateable="while_insert"
      IsNotNull="true"
      EntityAttrName="SiteCode"
      EntityUsage="TaskRun"
      AliasName="SITE_CODE" >
   </ViewAttribute>
   <ViewAttribute
      Name="TaskType"
      EntityAttrName="TaskType"
      EntityUsage="TaskRun"
      AliasName="TASK_TYPE" >
   </ViewAttribute>
   <ViewAttribute
      Name="ProcessName"
      EntityAttrName="ProcessName"
      EntityUsage="TaskRun"
      AliasName="PROCESS_NAME" >
   </ViewAttribute>
   <ViewAttribute
      Name="ProcessDomain"
      EntityAttrName="ProcessDomain"
      EntityUsage="TaskRun"
      AliasName="PROCESS_DOMAIN" >
   </ViewAttribute>
   <ViewAttribute
      Name="InputName"
      EntityAttrName="InputName"
      EntityUsage="TaskRun"
      AliasName="INPUT_NAME" >
   </ViewAttribute>
   <ViewAttribute
      Name="InputDomain"
      EntityAttrName="InputDomain"
      EntityUsage="TaskRun"
      AliasName="INPUT_DOMAIN" >
   </ViewAttribute>
   <ViewAttribute
      Name="ResponseName"
      EntityAttrName="ResponseName"
      EntityUsage="TaskRun"
      AliasName="RESPONSE_NAME" >
   </ViewAttribute>
   <ViewAttribute
      Name="ResponseDomain"
      EntityAttrName="ResponseDomain"
      EntityUsage="TaskRun"
      AliasName="RESPONSE_DOMAIN" >
   </ViewAttribute>
   <ViewAttribute
      Name="RejectName"
      EntityAttrName="RejectName"
      EntityUsage="TaskRun"
      AliasName="REJECT_NAME" >
   </ViewAttribute>
   <ViewAttribute
      Name="RejectDomain"
      EntityAttrName="RejectDomain"
      EntityUsage="TaskRun"
      AliasName="REJECT_DOMAIN" >
   </ViewAttribute>
   <ViewAttribute
      Name="InError"
      EntityAttrName="InError"
      EntityUsage="TaskRun"
      AliasName="IN_ERROR" >
   </ViewAttribute>
   <ViewLinkAccessor
      Name="FileProviderTraceView"
      ViewLink="com.cylande.unitedretail.batch.business.query.link.FileProviderTraceOfTaskRunLink"
      Type="oracle.jbo.RowIterator"
      IsUpdateable="false" >
   </ViewLinkAccessor>
   <ViewLinkAccessor
      Name="TaskAuditView"
      ViewLink="com.cylande.unitedretail.batch.business.query.link.TaskAuditsOfTaskRunLink"
      Type="oracle.jbo.RowIterator"
      IsUpdateable="false" >
   </ViewLinkAccessor>
</ViewObject>
