<?xml version='1.0' encoding='windows-1252' ?>
<!DOCTYPE JboPackage SYSTEM "jbo_03_01.dtd">

<JboPackage
   Name="association"
   SeparateXMLFiles="true"
   PackageName="com.cylande.unitedretail.batch.business.entity.association" >
   <DesignTime>
      <Attr Name="_ejbPackage" Value="false" />
      <Attr Name="_version" Value="10.1.3.41.57" />
   </DesignTime>
   <Containee
      Name="BatchRunsOfBatchRun"
      FullName="com.cylande.unitedretail.batch.business.entity.association.BatchRunsOfBatchRun"
      ObjectType="Association" >
   </Containee>
   <Containee
      Name="FileProviderTraceOfTaskRun"
      FullName="com.cylande.unitedretail.batch.business.entity.association.FileProviderTraceOfTaskRun"
      ObjectType="Association" >
   </Containee>
   <Containee
      Name="ParentBatchRun"
      FullName="com.cylande.unitedretail.batch.business.entity.association.ParentBatchRun"
      ObjectType="Association" >
   </Containee>
   <Containee
      Name="TaskAuditsOfTaskRun"
      FullName="com.cylande.unitedretail.batch.business.entity.association.TaskAuditsOfTaskRun"
      ObjectType="Association" >
   </Containee>
   <Containee
      Name="TaskRunsOfBatchRun"
      FullName="com.cylande.unitedretail.batch.business.entity.association.TaskRunsOfBatchRun"
      ObjectType="Association" >
   </Containee>
</JboPackage>
