<?xml version='1.0' encoding='windows-1252' ?>
<!DOCTYPE Entity SYSTEM "jbo_03_01.dtd">

<Entity
   Name="ProviderCrc"
   DBObjectType="table"
   DBObjectName="PROVIDER_CRC"
   AliasName="ProviderCrc"
   BindingStyle="JDBC"
   UseGlueCode="false"
   RowClass="com.cylande.unitedretail.batch.business.entity.ProviderCrcImpl"
   DefClass="com.cylande.unitedretail.framework.business.jbo.server.EntityDefImpl"
   CollClass="com.cylande.unitedretail.framework.business.jbo.server.EntityCache" >
   <DesignTime>
      <Attr Name="_isCodegen" Value="true" />
      <Attr Name="_version" Value="10.1.3.41.57" />
      <AttrArray Name="_publishEvents">
      </AttrArray>
      <Attr Name="_codeGenFlag2" Value="Access" />
   </DesignTime>
   <Attribute
      Name="Crc"
      IsUpdateable="while_insert"
      IsUnique="true"
      IsNotNull="true"
      Precision="8"
      ColumnName="CRC"
      Type="java.lang.String"
      ColumnType="VARCHAR2"
      SQLType="FLOAT"
      TableName="PROVIDER_CRC"
      PrimaryKey="true" >
   </Attribute>
   <Attribute
      Name="BatchName"
      Precision="255"
      ColumnName="BATCH_NAME"
      Type="java.lang.String"
      ColumnType="VARCHAR2"
      SQLType="VARCHAR"
      TableName="PROVIDER_CRC" >
   </Attribute>
   <Attribute
      Name="Overridden"
      ColumnName="OVERRIDDEN"
      Type="com.cylande.unitedretail.framework.business.jbo.domain.common.Booleans"
      ColumnType="NUMBER"
      SQLType="BIT"
      TableName="PROVIDER_CRC" >
   </Attribute>
   <Attribute
      Name="CreationTime"
      IsUpdateable="while_insert"
      ColumnName="CREATION_TIME"
      Type="com.cylande.unitedretail.framework.business.jbo.domain.common.Timestamp"
      ColumnType="TIMESTAMP"
      SQLType="TIMESTAMP"
      TableName="PROVIDER_CRC"
      HistoryColumn="DateHistory" >
   </Attribute>
   <Attribute
      Name="CreationUserCode"
      Precision="16"
      ColumnName="CREATION_USER_CODE"
      Type="java.lang.String"
      ColumnType="VARCHAR2"
      SQLType="VARCHAR"
      TableName="PROVIDER_CRC"
      HistoryColumn="UserHistory" >
   </Attribute>
   <Attribute
      Name="ModificationTime"
      ColumnName="MODIFICATION_TIME"
      Type="com.cylande.unitedretail.framework.business.jbo.domain.common.Timestamp"
      ColumnType="TIMESTAMP"
      SQLType="TIMESTAMP"
      TableName="PROVIDER_CRC" >
   </Attribute>
   <Attribute
      Name="ModificationUserCode"
      Precision="16"
      ColumnName="MODIFICATION_USER_CODE"
      Type="java.lang.String"
      ColumnType="VARCHAR2"
      SQLType="VARCHAR"
      TableName="PROVIDER_CRC"
      HistoryColumn="UserHistory" >
   </Attribute>
   <Key
      Name="CrcHistoryCrcCheck" >
      <AttrArray Name="Attributes">
         <Item Value="com.cylande.unitedretail.batch.business.entity.ProviderCrc.Crc" />
      </AttrArray>
      <DesignTime>
         <Attr Name="_checkCondition" Value="&#34;CRC&#34; IS NOT NULL" />
         <Attr Name="_isCheck" Value="true" />
         <Attr Name="_isNotNull" Value="true" />
         <Attr Name="_DBObjectName" Value="CRC_HISTORY_CRC_CHECK" />
      </DesignTime>
   </Key>
   <Key
      Name="CrchistoryPrimaryKey" >
      <AttrArray Name="Attributes">
         <Item Value="com.cylande.unitedretail.batch.business.entity.ProviderCrc.Crc" />
      </AttrArray>
      <DesignTime>
         <Attr Name="_isPrimary" Value="true" />
         <Attr Name="_DBObjectName" Value="CRCHISTORY_PRIMARY_KEY" />
      </DesignTime>
   </Key>
</Entity>
