<?xml version='1.0' encoding='windows-1252' ?>
<!DOCTYPE Association SYSTEM "jbo_03_01.dtd">

<Association
   Name="ParentBatchRun" >
   <DesignTime>
      <Attr Name="_isCodegen" Value="true" />
      <Attr Name="_version" Value="10.1.3.41.57" />
   </DesignTime>
   <AssociationEnd
      Name="BatchRunParents"
      Cardinality="1"
      Source="true"
      Owner="com.cylande.unitedretail.batch.business.entity.BatchRun"
      LockTopContainer="false" >
      <AttrArray Name="Attributes">
         <Item Value="com.cylande.unitedretail.batch.business.entity.BatchRun.Id" />
      </AttrArray>
      <DesignTime>
         <Attr Name="_finderName" Value="BatchRunParents" />
         <Attr Name="_aggregation" Value="0" />
         <Attr Name="_minCardinality" Value="1" />
         <Attr Name="_isUpdateable" Value="true" />
      </DesignTime>
   </AssociationEnd>
   <AssociationEnd
      Name="ParentIdBatchRun1"
      Cardinality="-1"
      Owner="com.cylande.unitedretail.batch.business.entity.BatchRun"
      ExposedAccessor="false" >
      <AttrArray Name="Attributes">
         <Item Value="com.cylande.unitedretail.batch.business.entity.BatchRun.ParentId" />
      </AttrArray>
      <DesignTime>
         <Attr Name="_finderName" Value="ParentIdBatchRun1" />
         <Attr Name="_aggregation" Value="0" />
         <Attr Name="_isUpdateable" Value="true" />
      </DesignTime>
   </AssociationEnd>
</Association>
